{"action_id":"official-surface-e2e-20260804-repair-2","binding":{"action_id":"official-surface-e2e-20260804-repair-2","evidence_class":"production_surface_non_scientific","provider_binding_sha256":"f3fceeea6678d48e428ebe8cb19b1ae72859d81b597bc83f2a2eba1fe1cf6154","run_spec_sha256":"606df10e007f613878dccfc569feb336ce42776ac2ee058a2b310d99bd18053f"},"binding_sha256":"64a3fa6d20780d45dcddcb2c9918a9bf2ad01b5806f75a381100ee72f0f48181","events":[{"event_sha256":"89913389d1785b0c15fd14307b8d5d21b4a4783e289e2a5ada298e599e9a7867","payload":{"allocation":{"worker-0":["surface-controller"],"worker-1":["surface-worker"]},"client_token":"pneuma-production-606df10e007f613878dccfc569feb336ce42776ac2ee058a"},"phase":"prepared","previous_event_sha256":"0000000000000000000000000000000000000000000000000000000000000000","sequence":1},{"event_sha256":"871ce60ad7450daf9d7df486317d828159672b40afedc1a863298207ad91c6aa","payload":{"child_job_ids":["i-00c1fb2d2b71c0058"],"parent_job_id":"i-00c1fb2d2b71c0058"},"phase":"submitting","previous_event_sha256":"89913389d1785b0c15fd14307b8d5d21b4a4783e289e2a5ada298e599e9a7867","sequence":2},{"event_sha256":"4d6ca1e845d29d992fb0398e12534e42d0733a1ae84c89e56b62b9e8fd1a7a46","payload":{"child_job_ids":["i-00c1fb2d2b71c0058"],"parent_job_id":"i-00c1fb2d2b71c0058"},"phase":"submitted","previous_event_sha256":"871ce60ad7450daf9d7df486317d828159672b40afedc1a863298207ad91c6aa","sequence":3},{"event_sha256":"15dd36c0b4ea76b8f58a32aadc34f34ba496a71038628f0e10d4b13159df8742","payload":{"child_job_ids":["i-00c1fb2d2b71c0058"],"detail_sha256":"16a21d770d950531feebcfba139f8da7c2bb758dfaccfc3b8b0cecf5aef41d7e","parent_job_id":"i-00c1fb2d2b71c0058"},"phase":"observation_error","previous_event_sha256":"4d6ca1e845d29d992fb0398e12534e42d0733a1ae84c89e56b62b9e8fd1a7a46","sequence":4},{"event_sha256":"f7aa81749ac121f446409bb2ae53fbf9686602ed062f551e223b0b8e4a94732f","payload":{"child_job_ids":["i-00c1fb2d2b71c0058"],"parent_job_id":"i-00c1fb2d2b71c0058","status_sha256":"43ab8a6bd91bb39736551ac80309b376e78f8ed0c56cda1f04639fc83862e27c"},"phase":"observing","previous_event_sha256":"15dd36c0b4ea76b8f58a32aadc34f34ba496a71038628f0e10d4b13159df8742","sequence":5},{"event_sha256":"77ff08fffbfe78b65659933fb7429e88c54a0fe7565b31fa8be70bd818b34a7d","payload":{"child_job_ids":["i-00c1fb2d2b71c0058"],"parent_job_id":"i-00c1fb2d2b71c0058","status_sha256":"43ab8a6bd91bb39736551ac80309b376e78f8ed0c56cda1f04639fc83862e27c"},"phase":"observing","previous_event_sha256":"f7aa81749ac121f446409bb2ae53fbf9686602ed062f551e223b0b8e4a94732f","sequence":6},{"event_sha256":"954959be5432f6cad354e83d8908458adf8a7b37187902f7b3257957d0323786","payload":{"child_job_ids":["i-00c1fb2d2b71c0058"],"parent_job_id":"i-00c1fb2d2b71c0058","status_sha256":"43ab8a6bd91bb39736551ac80309b376e78f8ed0c56cda1f04639fc83862e27c"},"phase":"observing","previous_event_sha256":"77ff08fffbfe78b65659933fb7429e88c54a0fe7565b31fa8be70bd818b34a7d","sequence":7},{"event_sha256":"153c045c4c874ec3b7f59b17b88cb5762a0b958707a8e4845acf4524b80d2077","payload":{"child_job_ids":["i-00c1fb2d2b71c0058"],"parent_job_id":"i-00c1fb2d2b71c0058","status_sha256":"cacac8a1bd0bb9a431fdc5a6f24714738eba0c471cdab28a43e2e3fd27fc24b3"},"phase":"observing","previous_event_sha256":"954959be5432f6cad354e83d8908458adf8a7b37187902f7b3257957d0323786","sequence":8},{"event_sha256":"14fb725deb27160151871e036ec01ea5e81179a52e029d66abcebb2ba15d1b57","payload":{"child_job_ids":["i-00c1fb2d2b71c0058"],"parent_job_id":"i-00c1fb2d2b71c0058","status_sha256":"2c4d5860420f27ce5514bc6eaba18df66e14f101b024181c40627d0bebb3b37e"},"phase":"observing","previous_event_sha256":"153c045c4c874ec3b7f59b17b88cb5762a0b958707a8e4845acf4524b80d2077","sequence":9},{"event_sha256":"dee69b8de7238c478ef72e456086048ee1a70735624c1d4c75f440983838b486","payload":{"child_job_ids":["i-00c1fb2d2b71c0058"],"parent_job_id":"i-00c1fb2d2b71c0058","status_sha256":"cacac8a1bd0bb9a431fdc5a6f24714738eba0c471cdab28a43e2e3fd27fc24b3"},"phase":"observing","previous_event_sha256":"14fb725deb27160151871e036ec01ea5e81179a52e029d66abcebb2ba15d1b57","sequence":10},{"event_sha256":"5303aeaefe869b5c6c413f59ab7b7cd65a13195310d8d00286e0d36ab15f6e43","payload":{"child_job_ids":["i-00c1fb2d2b71c0058"],"parent_job_id":"i-00c1fb2d2b71c0058","status_sha256":"2c4d5860420f27ce5514bc6eaba18df66e14f101b024181c40627d0bebb3b37e"},"phase":"observing","previous_event_sha256":"dee69b8de7238c478ef72e456086048ee1a70735624c1d4c75f440983838b486","sequence":11},{"event_sha256":"cbca8dfa93855621d033fc918e4d4ce08abaa40e3293e934b1fb8ecbcefd7c1c","payload":{"child_job_ids":["i-00c1fb2d2b71c0058"],"parent_job_id":"i-00c1fb2d2b71c0058","status_sha256":"cacac8a1bd0bb9a431fdc5a6f24714738eba0c471cdab28a43e2e3fd27fc24b3"},"phase":"observing","previous_event_sha256":"5303aeaefe869b5c6c413f59ab7b7cd65a13195310d8d00286e0d36ab15f6e43","sequence":12},{"event_sha256":"c603a10a7e0bc157f8190a775ea61dd3cfb6daa594d6d281472b45954b9d72ea","payload":{"child_job_ids":["i-00c1fb2d2b71c0058"],"parent_job_id":"i-00c1fb2d2b71c0058","status_sha256":"2c4d5860420f27ce5514bc6eaba18df66e14f101b024181c40627d0bebb3b37e"},"phase":"observing","previous_event_sha256":"cbca8dfa93855621d033fc918e4d4ce08abaa40e3293e934b1fb8ecbcefd7c1c","sequence":13},{"event_sha256":"220f8fc3e9359fd4661059f1dfe607e533ae30b47682cf20cf5a5bc6f3bb3bf1","payload":{"child_job_ids":["i-00c1fb2d2b71c0058"],"parent_job_id":"i-00c1fb2d2b71c0058","status_sha256":"cacac8a1bd0bb9a431fdc5a6f24714738eba0c471cdab28a43e2e3fd27fc24b3"},"phase":"observing","previous_event_sha256":"c603a10a7e0bc157f8190a775ea61dd3cfb6daa594d6d281472b45954b9d72ea","sequence":14},{"event_sha256":"b3e14e3c54b9ebb3e57c6c517579028f35265ec186de61d6fae4d29706dab3b5","payload":{"child_job_ids":["i-00c1fb2d2b71c0058"],"parent_job_id":"i-00c1fb2d2b71c0058","status_sha256":"2c4d5860420f27ce5514bc6eaba18df66e14f101b024181c40627d0bebb3b37e"},"phase":"observing","previous_event_sha256":"220f8fc3e9359fd4661059f1dfe607e533ae30b47682cf20cf5a5bc6f3bb3bf1","sequence":15},{"event_sha256":"7cae78dba78b0e924a050a3c044607097c296fae485221cc033b66ccbd64e7e3","payload":{"child_job_ids":["i-00c1fb2d2b71c0058"],"parent_job_id":"i-00c1fb2d2b71c0058","status_sha256":"cacac8a1bd0bb9a431fdc5a6f24714738eba0c471cdab28a43e2e3fd27fc24b3"},"phase":"observing","previous_event_sha256":"b3e14e3c54b9ebb3e57c6c517579028f35265ec186de61d6fae4d29706dab3b5","sequence":16},{"event_sha256":"366e2c58aafa47d12b782ae414687680ea2f957809312f41196cf6db712f9f9c","payload":{"child_job_ids":["i-00c1fb2d2b71c0058"],"parent_job_id":"i-00c1fb2d2b71c0058","status_sha256":"2c4d5860420f27ce5514bc6eaba18df66e14f101b024181c40627d0bebb3b37e"},"phase":"observing","previous_event_sha256":"7cae78dba78b0e924a050a3c044607097c296fae485221cc033b66ccbd64e7e3","sequence":17},{"event_sha256":"acc2d5ba962f60d39a8b06510af45466e5c71e2db544f77de4051026842179ab","payload":{"child_job_ids":["i-00c1fb2d2b71c0058"],"parent_job_id":"i-00c1fb2d2b71c0058","status_sha256":"cacac8a1bd0bb9a431fdc5a6f24714738eba0c471cdab28a43e2e3fd27fc24b3"},"phase":"observing","previous_event_sha256":"366e2c58aafa47d12b782ae414687680ea2f957809312f41196cf6db712f9f9c","sequence":18},{"event_sha256":"2772e56854a6d0cadd879bb9a6045af2e732f7a1d61f13ef5265c76dc091aa13","payload":{"child_job_ids":["i-00c1fb2d2b71c0058"],"parent_job_id":"i-00c1fb2d2b71c0058","status_sha256":"2c4d5860420f27ce5514bc6eaba18df66e14f101b024181c40627d0bebb3b37e"},"phase":"observing","previous_event_sha256":"acc2d5ba962f60d39a8b06510af45466e5c71e2db544f77de4051026842179ab","sequence":19},{"event_sha256":"46aa38c510e8f768367a75006f9a4b18eb1c84f55445839a56293e9aaa6c9ca3","payload":{"child_job_ids":["i-00c1fb2d2b71c0058"],"parent_job_id":"i-00c1fb2d2b71c0058","status_sha256":"cacac8a1bd0bb9a431fdc5a6f24714738eba0c471cdab28a43e2e3fd27fc24b3"},"phase":"observing","previous_event_sha256":"2772e56854a6d0cadd879bb9a6045af2e732f7a1d61f13ef5265c76dc091aa13","sequence":20},{"event_sha256":"f763aeafa8368cd1c43e2c8319a638fd860dc480d6ab48ab42eafe9633cb4d19","payload":{"child_job_ids":["i-00c1fb2d2b71c0058"],"parent_job_id":"i-00c1fb2d2b71c0058","status_sha256":"2c4d5860420f27ce5514bc6eaba18df66e14f101b024181c40627d0bebb3b37e"},"phase":"observing","previous_event_sha256":"46aa38c510e8f768367a75006f9a4b18eb1c84f55445839a56293e9aaa6c9ca3","sequence":21},{"event_sha256":"f095e1bfd458e850731fa5cf2269b2c1e65df4ceb0a9c1adb120de51eab4a683","payload":{"child_job_ids":["i-00c1fb2d2b71c0058"],"parent_job_id":"i-00c1fb2d2b71c0058","status_sha256":"cacac8a1bd0bb9a431fdc5a6f24714738eba0c471cdab28a43e2e3fd27fc24b3"},"phase":"observing","previous_event_sha256":"f763aeafa8368cd1c43e2c8319a638fd860dc480d6ab48ab42eafe9633cb4d19","sequence":22},{"event_sha256":"932cb63a7bd013603b50a30f19742d2729a24a7433a19e4412e94d24b194215f","payload":{"child_job_ids":["i-00c1fb2d2b71c0058"],"parent_job_id":"i-00c1fb2d2b71c0058","status_sha256":"2c4d5860420f27ce5514bc6eaba18df66e14f101b024181c40627d0bebb3b37e"},"phase":"observing","previous_event_sha256":"f095e1bfd458e850731fa5cf2269b2c1e65df4ceb0a9c1adb120de51eab4a683","sequence":23},{"event_sha256":"29b62d83bd465e31339cb2fb1b70515a9faeae9470fad2c6276384978b355887","payload":{"child_job_ids":["i-00c1fb2d2b71c0058"],"parent_job_id":"i-00c1fb2d2b71c0058","status_sha256":"cacac8a1bd0bb9a431fdc5a6f24714738eba0c471cdab28a43e2e3fd27fc24b3"},"phase":"observing","previous_event_sha256":"932cb63a7bd013603b50a30f19742d2729a24a7433a19e4412e94d24b194215f","sequence":24},{"event_sha256":"71cc9240ea9eef34020fabc26091714658cc09ae95c38ad3df12fba0686c6431","payload":{"child_job_ids":["i-00c1fb2d2b71c0058"],"parent_job_id":"i-00c1fb2d2b71c0058","status_sha256":"2c4d5860420f27ce5514bc6eaba18df66e14f101b024181c40627d0bebb3b37e"},"phase":"observing","previous_event_sha256":"29b62d83bd465e31339cb2fb1b70515a9faeae9470fad2c6276384978b355887","sequence":25},{"event_sha256":"685074a3f6a13116c6ffeed26aecb45a710778a7460e2b59dd52e5672c0fb354","payload":{"child_job_ids":["i-00c1fb2d2b71c0058"],"parent_job_id":"i-00c1fb2d2b71c0058"